"Number","Start Time","End Time","Duration","Symbol Duration","TTS Symbol Duration","TTS Speed Closest","Speaker","Text"
"1073","01:00:13,972","01:00:20,175","6.203","0.0666989247311828","0.06425396825396826","1.8","female","You can't just come in without writing that you have been there for so long, it's a security."
"1074","01:00:21,691","01:00:26,868","5.177","0.09244642857142857","0.08321693121693122","1.3","female","And I say to them, go to the president's office, Kuchma,"
"1075","01:00:26,892","01:00:29,920","3.028","0.061795918367346936","0.060783068783068786","1.9","female","and see when he has been there for the last time."
"1076","01:00:29,945","01:00:31,651","1.706","0.07754545454545454","0.07559788359788361","1.5","female","He goes in and says..."
"1077","01:00:31,675","01:00:38,200","6.525","0.11863636363636364","0.1131005291005291","1.0","female","It was in the summer of some year, he says, in January."
"1078","01:00:38,200","01:00:39,864","1.664","0.06933333333333333","0.06755555555555556","1.7","female","I see a big combination."
"1079","01:00:39,889","01:00:43,828","3.939","0.17126086956521738","0.16228571428571428","0.7","female","Yes. But it's real art."
"1080","01:00:43,852","01:00:52,175","8.323","0.12422388059701493","0.1131005291005291","1.0","female","It's art to guess in the distance what's going on in the big house."
"1081","01:00:52,200","01:00:56,855","4.655","0.09697916666666667","0.09532275132275132","1.2","female","Well, it's like that. He set 1+1 up, I must say."
"1082","01:00:57,200","01:00:59,200","2.0","0.2222222222222222","0.1903915343915344","0.6","female","And then"
"1083","01:00:59,200","01:01:02,823","3.623","0.06587272727272728","0.06425396825396826","1.8","female","1+1 apologized, Aleksandr Yefimovich  in the same way?"
"1084","01:01:04,200","01:01:06,711","2.511","0.03804545454545455","0.0452063492063492","2.5","female","This page, by the way Yes, but there wasn`t everything ambiguous."
"1085","01:01:06,736","01:01:07,569","0.833","0.06941666666666667","0.06755555555555556","1.7","female","Unambiguous?"
"1086","01:01:07,594","01:01:09,468","1.874","0.11023529411764707","0.10302645502645504","1.1","female","Unambiguous, yes."
"1087","01:01:09,492","01:01:15,126","5.634","0.08408955223880597","0.08321693121693122","1.3","female","And just people at 1+1... I think some part, not all, not everyone,"
"1088","01:01:15,150","01:01:18,683","3.533","0.06542592592592593","0.06425396825396826","1.8","female","understood that the wind won't blow in that direction."
"1089","01:01:19,200","01:01:22,200","3.0","0.039473684210526314","0.0452063492063492","2.5","female","Really, it's You weren't there at all. You were already on the 5th channel."
"1090","01:01:22,200","01:01:25,268","3.068","0.053824561403508775","0.05147089947089947","2.2","female","Yes, I was already on the 5th channel. But I Well, since"
"1091","01:01:25,292","01:01:28,730","3.438","0.07640000000000001","0.07559788359788361","1.5","female","not much time has passed, I know many people."
"1092","01:01:28,755","01:01:31,976","3.221","0.06077358490566038","0.057227513227513224","2.0","female","In fact, most of them have not changed in appearance."
"1093","01:01:33,983","01:01:37,233","3.25","0.08125","0.07559788359788361","1.5","female","I would not say that the behavior of 1+1"
"1094","01:01:37,257","01:01:43,175","5.918","0.08576811594202899","0.08321693121693122","1.3","female","was as perfect as possible, not only because of Pikhovshen, not only."
"1095","01:01:44,305","01:01:49,148","4.843","0.09883673469387755","0.09532275132275132","1.2","female","I think that Lyosha Rodiansky was well-organized,"
"1096","01:01:49,172","01:01:54,200","5.028","0.09141818181818182","0.08321693121693122","1.3","female","and he understood that if we say that this is business,"
"1097","01:01:54,994","01:02:00,200","5.206","0.0800923076923077","0.07559788359788361","1.5","female","then it is necessary to save it, and there was already a feeling."
"1098","01:02:00,389","01:02:03,908","3.519","0.05865","0.057227513227513224","2.0","female","I did not have a feeling that we had won on the 5th channel."
"1099","01:02:03,932","01:02:06,839","2.907","0.042130434782608694","0.0452063492063492","2.5","female","I was afraid that something would happen to me until the last moment."
"1100","01:02:06,864","01:02:08,200","1.336","0.047714285714285716","0.0452063492063492","2.5","female","Well, until the third round."
"1101","01:02:08,200","01:02:10,260","2.06","0.515","0.29079365079365077","0.3","female","Yes."
"1102","01:02:10,284","01:02:15,142","4.858","0.06654794520547945","0.06425396825396826","1.8","female","And people who, maybe because he was in Moscow and was more away from it,"
"1103","01:02:15,166","01:02:18,200","3.034","0.07223809523809524","0.07144973544973544","1.6","female","because I was watching it from the inside,"
"1104","01:02:18,200","01:02:24,714","6.514","0.081425","0.07559788359788361","1.5","female","and he was on the side, maybe it helped him to tell himself that it`s not right."
"1105","01:02:24,739","01:02:25,739","1.0","0.043478260869565216","0.0452063492063492","2.5","female","We are not going there."
"1106","01:02:25,764","01:02:26,603","0.839","0.024676470588235293","0.0452063492063492","2.5","female","Yes, we are losing something here."
"1107","01:02:26,628","01:02:27,628","1.0","0.058823529411764705","0.057227513227513224","2.0","female","We are coming in."
"1108","01:02:27,653","01:02:35,175","7.522","0.08265934065934066","0.07559788359788361","1.5","female","Yes. And so it was. And then it went on. But, listen, these are all very difficult moments."
"1109","01:02:35,200","01:02:49,200","14.0","0.17073170731707318","0.16228571428571428","0.7","female","And until TV is not a business, until there is no option of freedom, it cannot be."
"1110","01:02:49,694","01:02:54,685","4.991","0.07678461538461538","0.07559788359788361","1.5","female","All the talks about the fact that TV can somehow speak the truth,"
"1111","01:02:55,344","01:03:01,200","5.856","0.0915","0.08321693121693122","1.3","female","the American can, because this is a business, these are profits."
"1112","01:03:01,200","01:03:17,200","16.0","0.2191780821917808","0.1903915343915344","0.6","female","Ethier in 2017 or 2018, I don't remember, they added 800 million dollars."
"1113","01:03:17,596","01:03:19,200","1.604","0.04455555555555556","0.0452063492063492","2.5","female","It is also such a story, Mr. Mykolo."
"1114","01:03:19,200","01:03:23,298","4.098","0.09530232558139534","0.08321693121693122","1.3","female","Because, you know, if CNN is for democracy,"
"1115","01:03:23,323","01:03:28,761","5.438","0.07997058823529411","0.07559788359788361","1.5","female","and Fox is for the Republicans, then this is already a split, right?"
"1116","01:03:29,682","01:03:35,882","6.2","0.09538461538461539","0.09532275132275132","1.2","female","But the problem is that this is their belief, not an instruction."
"1117","01:03:36,485","01:03:43,200","6.715","0.0945774647887324","0.08321693121693122","1.3","female","They just don't hire Fox people who will sympathize with the Democrats."
"1118","01:03:43,200","01:03:44,200","1.0","0.04","0.0452063492063492","2.5","female","They don't hire in CNN..."
"1119","01:03:44,200","01:03:48,200","4.0","0.07692307692307693","0.07559788359788361","1.5","female","Do we already copy this system? Do we have channels?"
"1120","01:03:48,200","01:03:51,200","3.0","0.05084745762711865","0.049439153439153435","2.3","female","Unfortunately, I don't know. We don't have such a division."
"1121","01:03:51,200","01:03:53,200","2.0","0.05","0.049439153439153435","2.3","female","Only in the worst possible way, I think."
"1122","01:03:53,200","01:03:56,200","3.0","0.06666666666666667","0.06425396825396826","1.8","female","The question is different. It is very simple."
"1123","01:03:56,200","01:04:10,423","14.223","0.19483561643835617","0.1903915343915344","0.6","female","Here is a billionaire sitting, and Natalka Moseichuk has a rating of 50%."
"1124","01:04:12,147","01:04:15,467","3.32","0.08736842105263158","0.08321693121693122","1.3","female","And Mykola Veresen has a rating of 5%."
"1125","01:04:17,411","01:04:24,200","6.789","0.09051999999999999","0.08321693121693122","1.3","female","And here he is, this billionaire, who pays so much to maintain the channel."
"1126","01:04:24,200","01:04:25,403","1.203","0.10936363636363637","0.10302645502645504","1.1","female","In any way."
"1127","01:04:25,882","01:04:28,882","3.0","0.04838709677419355","0.04791534391534392","2.4","female","When there is Oprah Winfrey, who earned a billion for herself,"
"1128","01:04:28,907","01:04:32,479","3.572","0.0533134328358209","0.05147089947089947","2.2","female","and how much she earned for the channel, it's just hard to imagine."
"1129","01:04:33,200","01:04:36,868","3.668","0.10188888888888889","0.09532275132275132","1.2","female","And that rich man, who is the owner."
"1130","01:04:38,200","01:04:42,948","4.748","0.0552093023255814","0.054603174603174605","2.1","female","Well, how is it? I won't take away Oprah. Then I'll just throw money out of my pocket."
"1131","01:04:44,200","01:04:45,734","1.534","0.03933333333333333","0.0452063492063492","2.5","female","And in Ukraine, there is no such thing."
"1132","01:04:46,200","01:04:48,200","2.0","0.07407407407407407","0.07144973544973544","1.6","female","Either the worst presenter."
"1133","01:04:48,225","01:04:51,200","2.975","0.05409090909090909","0.05147089947089947","2.2","female","Or the best. Either a program with the highest ratings."
"1134","01:04:51,200","01:04:53,200","2.0","0.05405405405405406","0.05147089947089947","2.2","female","Or a program with the lowest ratings."
"1135","01:04:53,200","01:04:57,200","4.0","0.12121212121212122","0.1131005291005291","1.0","female","I add up to 100 million per year."
"1136","01:04:57,200","01:04:58,964","1.764","0.047675675675675676","0.0452063492063492","2.5","female","Before the war, the 1+1 came to zero."
"1137","01:04:59,200","01:05:04,200","5.0","0.09615384615384616","0.09532275132275132","1.2","female","Well, it's not a profit, Natalka, it's not a profit."
"1138","01:05:04,200","01:05:10,200","6.0","0.15","0.1423068783068783","0.8","female","When it's equal ... I agree, absolutely."
"1139","01:05:10,200","01:05:12,200","2.0","0.1111111111111111","0.10302645502645504","1.1","female","Then it will work."
"1140","01:05:12,200","01:05:15,200","3.0","0.06818181818181818","0.06755555555555556","1.7","female","All journalism is like this, this, and that."
"1141","01:05:15,200","01:05:17,593","2.393","0.06647222222222221","0.06425396825396826","1.8","female","Maybe now this TikTok is all modern."
"1142","01:05:17,618","01:05:19,200","1.582","0.098875","0.09532275132275132","1.2","female","Or some YouTube."
"1143","01:05:19,200","01:05:21,200","2.0","0.07692307692307693","0.07559788359788361","1.5","female","It's very difficult there."
"1144","01:05:21,200","01:05:24,200","3.0","0.0625","0.060783068783068786","1.9","female","Maybe something will change there. I don't know."
"1145","01:05:24,200","01:05:27,200","3.0","0.05454545454545454","0.05147089947089947","2.2","female","It will change if the business starts to work normally."
"1146","01:05:27,200","01:05:29,200","2.0","0.04878048780487805","0.04791534391534392","2.4","female","Because we are dependent on the business."
"1147","01:05:29,200","01:05:33,108","3.908","0.0977","0.09532275132275132","1.2","female","Even though we're going to burst, but we"
"1148","01:05:33,132","01:05:35,200","2.068","0.047","0.0452063492063492","2.5","female","will not be able to have a host become Oprah"
"1149","01:05:35,200","01:05:38,200","3.0","0.06382978723404255","0.060783068783068786","1.9","female","and bring millions and billions to the channel."
"1150","01:05:38,200","01:05:39,200","1.0","0.08333333333333333","0.08321693121693122","1.3","female","No, not yet."
"1151","01:05:39,200","01:05:43,200","4.0","0.08695652173913043","0.08321693121693122","1.3","female","No, listen, we are secondary, we are tertiary."
"1152","01:05:43,483","01:05:45,200","1.717","0.06868","0.06755555555555556","1.7","female","The question is not that."
"1153","01:05:45,200","01:05:50,148","4.948","0.13372972972972974","0.13104761904761905","0.9","female","The question is that television works"
"1154","01:05:50,172","01:05:59,271","9.099","0.13380882352941176","0.13104761904761905","0.9","female","in those countries where there is good production and good salaries."
"1155","01:06:00,503","01:06:05,804","5.301","0.11043750000000001","0.10302645502645504","1.1","female","When each Ukrainian has a salary of 500 dollars,"
"1156","01:06:08,225","01:06:15,439","7.214","0.16776744186046513","0.16228571428571428","0.7","female","advertisers understand that we about 10%..."
"1157","01:06:17,341","01:06:20,200","2.859","0.058346938775510206","0.057227513227513224","2.0","female","we collect this money, well, through advertising."
"1158","01:06:20,930","01:06:23,770","2.84","0.09793103448275861","0.09532275132275132","1.2","female","And we have 30 or 40 million."
"1159","01:06:24,881","01:06:32,762","7.881","0.1176268656716418","0.1131005291005291","1.0","female","We take 500 dollars for 40 million, multiply it, and then take 10%."
"1160","01:06:33,081","01:06:39,719","6.638","0.18965714285714286","0.16228571428571428","0.7","female","And we have billions on the market."
"1161","01:06:39,744","01:06:49,744","10.0","0.16393442622950818","0.16228571428571428","0.7","female","Well ... Then Natalka will get a million a year, for example."
"1162","01:06:50,768","01:06:53,200","2.432","0.076","0.07559788359788361","1.5","female","But we don't have such salaries."
"1163","01:06:53,200","01:06:55,200","2.0","0.027777777777777776","0.0452063492063492","2.5","female","Well, first, we don't have such salaries, because the second is reality."
"1164","01:06:55,200","01:06:57,200","2.0","0.05128205128205128","0.049439153439153435","2.3","female","Because what will happen to television?"
"1165","01:06:57,200","01:06:59,200","2.0","0.07142857142857142","0.06755555555555556","1.7","female","It is now only known to God."
"1166","01:06:59,200","01:07:01,200","2.0","0.06666666666666667","0.06425396825396826","1.8","female","And such a period is critical."
"1167","01:07:01,200","01:07:06,200","5.0","0.07142857142857142","0.06755555555555556","1.7","female","It will either go up and, supposedly, become CNN or Fox after the war."
"1168","01:07:06,200","01:07:07,776","1.576","0.0543448275862069","0.05147089947089947","2.2","female","No, it will never become CNN."
"1169","01:07:07,801","01:07:09,801","2.0","0.06666666666666667","0.06425396825396826","1.8","female","Or ... Impossible, because ..."
"1170","01:07:09,826","01:07:12,826","3.0","0.03488372093023256","0.0452063492063492","2.5","female","It will become such an entertainment option of something, where there will be only ..."
"1171","01:07:12,851","01:07:13,851","1.0","0.04","0.0452063492063492","2.5","female","No, it will be like this."
"1172","01:07:13,876","01:07:19,175","5.299","0.14719444444444446","0.1423068783068783","0.8","female","You see, we have a colonial country."
"1173","01:07:19,797","01:07:21,200","1.403","0.06377272727272727","0.060783068783068786","1.9","female","For a long, long time."
"1174","01:07:21,200","01:07:27,200","6.0","0.08333333333333333","0.08321693121693122","1.3","female","When my young colleagues ask me, why there is no BBC, what should we do?"
"1175","01:07:27,200","01:07:29,828","2.628","0.10512","0.10302645502645504","1.1","female","I say, no, it won't work."
"1176","01:07:30,200","01:07:38,440","8.24","0.10430379746835443","0.10302645502645504","1.1","female","The British have an interesting world because their neighbor was born in India."
"1177","01:07:39,487","01:07:43,374","3.887","0.058893939393939394","0.057227513227513224","2.0","female","And that's why the British are interested in the news about India."
"1178","01:07:43,686","01:07:46,853","3.167","0.08334210526315788","0.08321693121693122","1.3","female","About Burma, about this, about Africa."
"1179","01:07:47,200","01:07:49,472","2.272","0.06884848484848484","0.06755555555555556","1.7","female","Who cares about Burma in Ukraine?"
"1180","01:07:53,200","01:07:54,200","1.0","0.1","0.09532275132275132","1.2","female","That's it."
"1181","01:07:54,200","01:07:56,200","2.0","0.06896551724137931","0.06755555555555556","1.7","female","I would ask another question."
"1182","01:07:56,200","01:07:59,200","3.0","0.07692307692307693","0.07559788359788361","1.5","female","Are they ready to work like on the BBC?"
"1183","01:07:59,200","01:08:04,200","5.0","0.056818181818181816","0.054603174603174605","2.1","female","Because of the way they work there on the BBC, we would already be shouting, censorship,"
"1184","01:08:04,200","01:08:07,200","3.0","0.061224489795918366","0.060783068783068786","1.9","female","restriction of my journalistic rights, and so on."
"1185","01:08:07,200","01:08:08,824","1.624","0.058","0.057227513227513224","2.0","female","Because it is very, very ..."
"1186","01:08:09,200","01:08:12,200","3.0","0.075","0.07144973544973544","1.6","female","It is an obstructed system, I would say."
"1187","01:08:12,200","01:08:15,200","3.0","0.05357142857142857","0.05147089947089947","2.2","female","But, okay, we will not judge. They have their own rules."
"1188","01:08:17,200","01:08:18,643","1.443","0.07215","0.07144973544973544","1.6","female","Kuchma and Gongadze."
"1189","01:08:19,200","01:08:23,200","4.0","0.09302325581395349","0.08321693121693122","1.3","female","That's right ... That's right, I won't say."
"1190","01:08:23,200","01:08:25,200","2.0","0.05714285714285714","0.054603174603174605","2.1","female","That's right, such ... I won't say."
"1191","01:08:25,200","01:08:26,200","1.0","0.05555555555555555","0.054603174603174605","2.1","female","A difficult story."
"1192","01:08:26,200","01:08:27,200","1.0","0.05","0.049439153439153435","2.3","female","But you know, right?"
"1193","01:08:27,200","01:08:31,200","4.0","0.08333333333333333","0.08321693121693122","1.3","female","No, I just know ... Why don't you talk about it?"
"1194","01:08:31,200","01:08:33,652","2.452","0.052170212765957444","0.05147089947089947","2.2","female","Den Borisovich Yanevsky didn't talk about that."
"1195","01:08:33,921","01:08:37,921","4.0","0.07272727272727272","0.07144973544973544","1.6","female","He also said that he knows who ... No, I guess ... How?"
"1196","01:08:37,947","01:08:44,947","7.0","0.175","0.16228571428571428","0.7","female","I know the vector, I don't know by name."
"1197","01:08:45,200","01:08:51,430","6.23","0.07160919540229886","0.07144973544973544","1.6","female","I know the vector, I am strongly of great doubt that Kuchma was somehow involved there."
"1198","01:08:52,595","01:08:59,200","6.604","0.10006060606060606","0.09532275132275132","1.2","female","And I strongly ... In general, I will say this phrase beautifully."
"1199","01:08:59,225","01:09:00,501","1.276","0.07088888888888889","0.06755555555555556","1.7","female","Cherchez la femme."
"1200","01:09:00,526","01:09:01,563","1.037","0.03988461538461538","0.0452063492063492","2.5","female","I won't say anything more."
"1201","01:09:02,332","01:09:06,200","3.867","0.06905357142857142","0.06755555555555556","1.7","female","You know, the whole country knows who you are targeting."
"1202","01:09:06,200","01:09:11,200","5.0","0.07936507936507936","0.07559788359788361","1.5","female","But no one wants to touch it because all the figures are alive."
"1203","01:09:12,193","01:09:13,200","1.007","0.055944444444444436","0.054603174603174605","2.1","female","More or less, yes."
"1204","01:09:13,200","01:09:16,200","3.0","0.06521739130434782","0.06425396825396826","1.8","female","It's incorrect in relation to both memory and"
"1205","01:09:16,200","01:09:27,200","11.0","0.1527777777777778","0.1423068783068783","0.8","female","No, it's not that. I stopped this wave and this fashion for a long time."
"1206","01:09:28,716","01:09:33,951","5.234","0.20936","0.1903915343915344","0.6","female","I'll give you an example."
"1207","01:09:33,982","01:09:41,707","7.726","0.19315","0.1903915343915344","0.6","female","When Kryvenko Sashko crashed in the car,"
"1208","01:09:41,732","01:09:46,207","4.475","0.0913265306122449","0.08321693121693122","1.3","female","they wanted to do the second episode of Gongadze."
"1209","01:09:47,837","01:09:51,175","3.338","0.10115151515151516","0.09532275132275132","1.2","female","And they wanted to politicize it."
"1210","01:09:53,001","01:09:56,845","3.844","0.11305882352941177","0.10302645502645504","1.1","female","I was just burying Sashko in Lviv."
"1211","01:09:56,870","01:10:03,175","6.305","0.07689024390243902","0.07559788359788361","1.5","female","And I had to go back to Kyiv because Taras Pratsuk died right that day in Baghdad."
"1212","01:10:03,200","01:10:04,047","0.847","0.105875","0.10302645502645504","1.1","female","In Iraq."
"1213","01:10:04,072","01:10:07,588","3.516","0.08176744186046511","0.07559788359788361","1.5","female","Yes. And these were my two closest friends."
"1214","01:10:08,200","01:10:14,028","5.828","0.10596363636363637","0.10302645502645504","1.1","female","And they just started saying, let's raise this scandal,"
"1215","01:10:14,052","01:10:17,377","3.325","0.050378787878787884","0.049439153439153435","2.3","female","come on, come on, come on, we'll earn political dividends on this."
"1216","01:10:18,200","01:10:21,200","3.0","0.08823529411764706","0.08321693121693122","1.3","female","And I just called a lot of people."
"1217","01:10:21,200","01:10:26,200","5.0","0.0847457627118644","0.08321693121693122","1.3","female","I called Yulia, I said, Yulia, I beg you, Tymoshenko, stop."
"1218","01:10:27,565","01:10:30,105","2.54","0.04980392156862745","0.049439153439153435","2.3","female","And she said, I heard you, I understood your logic,"
"1219","01:10:30,129","01:10:33,182","3.053","0.071","0.06755555555555556","1.7","female","okay, that's it, we're not going to use it."
"1220","01:10:34,193","01:10:43,313","9.12","0.1403076923076923","0.13104761904761905","0.9","female","Just understand how people really like to exploit politics today."
"1221","01:10:43,575","01:10:45,746","2.171","0.04341999999999999","0.0452063492063492","2.5","female","And still, journalists are not really politicians."
"1222","01:10:45,771","01:10:47,771","2.0","0.046511627906976744","0.0452063492063492","2.5","female","Well, they shouldn't be politicians at all."
"1223","01:10:48,757","01:10:50,837","2.08","0.065","0.06425396825396826","1.8","female","During the war, probably should."
"1224","01:10:51,687","01:10:55,365","3.678","0.06233898305084746","0.060783068783068786","1.9","female","Well, you can't not be a patriot, you can't be independent."
"1225","01:10:57,308","01:10:58,302","0.994","0.06626666666666667","0.06425396825396826","1.8","female","From the state."
"1226","01:10:58,327","01:11:01,828","3.501","0.0729375","0.07144973544973544","1.6","female","Yes, from the society, from the state, you know."
"1227","01:11:01,853","01:11:06,200","4.347","0.06586363636363637","0.06425396825396826","1.8","female","We take the BBC example and do it right, and we have to follow it."
"1228","01:11:06,200","01:11:08,828","2.628","0.09385714285714286","0.08321693121693122","1.3","female","But we also have to remember"
"1229","01:11:08,852","01:11:15,537","6.685","0.08681818181818181","0.08321693121693122","1.3","female","that in the British territories, when there was a war? There was never a war."
"1230","01:11:15,562","01:11:17,200","1.638","0.0511875","0.049439153439153435","2.3","female","There were not a thousand years."
"1231","01:11:17,200","01:11:20,097","2.897","0.09053125","0.08321693121693122","1.3","female","Here, Wilhelm, the winner, came."
"1232","01:11:20,122","01:11:22,200","2.078","0.0649375","0.06425396825396826","1.8","female","This, this, this was a disaster."
"1233","01:11:22,200","01:11:24,592","2.392","0.06644444444444444","0.06425396825396826","1.8","female","And so only rockets flew from above."
"1234","01:11:24,910","01:11:27,577","2.667","0.066675","0.06425396825396826","1.8","female","Therefore, you can be independent there."
"1235","01:11:27,863","01:11:29,738","1.875","0.05859375","0.057227513227513224","2.0","female","And they are really independent."
"1236","01:11:29,763","01:11:33,098","3.335","0.06413461538461539","0.060783068783068786","1.9","female","The BBC was against the expansion of the Suez Canal,"
"1237","01:11:33,122","01:11:36,756","3.634","0.0672962962962963","0.06425396825396826","1.8","female","against the Maldives, the Falkland Islands, and so on."
"1238","01:11:36,781","01:11:38,122","1.341","0.0745","0.07144973544973544","1.6","female","But it's not here."
"1239","01:11:38,479","01:11:42,345","3.866","0.05154666666666667","0.05147089947089947","2.2","female","What would the BBC be like if there was an invasion of the Kingdom of Kent?"
"1240","01:11:42,511","01:11:46,310","3.799","0.08442222222222222","0.08321693121693122","1.3","female","Well, such, serious, with a foreign presence."
"1241","01:11:46,569","01:11:47,569","1.0","0.05","0.049439153439153435","2.3","female","What would they say?"
"1242","01:11:47,594","01:11:48,594","1.0","0.07142857142857142","0.06755555555555556","1.7","female","We don't know."
"1243","01:11:48,619","01:11:53,457","4.838","0.06537837837837839","0.06425396825396826","1.8","female","There just wasn't, there was no evidence, there was no basis for evidence."
"1244","01:11:53,482","01:11:59,175","5.693","0.06396629213483146","0.060783068783068786","1.9","female","It's not exactly against the invasion of Falkland but about Margaret Thatcher's politics."
