"Number","Start Time","End Time","Duration","Symbol Duration","TTS Symbol Duration","TTS Speed Closest","Speaker","Text"
"541","00:29:25,480","00:29:30,920","5.44","0.060444444444444446","0.057227513227513224","2.0","female","They didn't care about the currency anymore, it was possible to exchange it on the street."
"542","00:29:30,920","00:29:34,640","3.72","0.08857142857142858","0.08321693121693122","1.3","female","In short, there were some obvious changes."
"543","00:29:34,640","00:29:43,240","8.6","0.1075","0.10302645502645504","1.1","female","People's Movement, Chornovyl, a lot of dissidents were released, they came back."
"544","00:29:43,240","00:29:45,188","1.948","0.05903030303030303","0.057227513227513224","2.0","female","In short, something is happening."
"545","00:29:45,212","00:29:53,080","7.868","0.09959493670886076","0.09532275132275132","1.2","female","We came to Minsk, and they didn't even understand what they were talking about."
"546","00:29:53,821","00:29:58,440","4.619","0.0745","0.07144973544973544","1.6","female","They had the same salaries, I remember there was such a shock."
"547","00:29:59,012","00:30:03,560","4.548","0.09281632653061224","0.08321693121693122","1.3","female","All the journalists gathered, there were 7 of us."
"548","00:30:07,504","00:30:14,640","7.136","0.08202298850574713","0.07559788359788361","1.5","female","Time, Guardian, Christian Science Monitor, something else, but I won't go into details."
"549","00:30:14,640","00:30:20,640","6.0","0.07228915662650602","0.07144973544973544","1.6","female","We were in some kind of cafe, there were a few of them in Kyiv and they were called"
"550","00:30:20,640","00:30:26,640","6.0","0.125","0.1131005291005291","1.0","female","cooperative restaurants, they started to appear."
"551","00:30:27,346","00:30:33,767","6.421","0.10356451612903227","0.10302645502645504","1.1","female","And since the exchange rate was crazy, something for a dollar,"
"552","00:30:33,792","00:30:40,887","7.095","0.07796703296703296","0.07559788359788361","1.5","female","and we didn't have money, as we hold them now, carefully folded, because they were pennies."
"553","00:30:40,912","00:30:44,961","4.049","0.13496666666666668","0.13104761904761905","0.9","female","If you earned, let's say, 500,"
"554","00:30:44,985","00:30:49,967","4.982","0.055977528089887645","0.054603174603174605","2.1","female","it was considered that you were a billionaire if you had a salary of 200 dollars a month."
"555","00:30:49,992","00:30:56,109","6.117","0.08156","0.07559788359788361","1.5","female","200 dollars in Kyiv in 1990, in 1991, well, that's it, life was successful."
"556","00:30:57,656","00:30:59,600","1.944","0.05890909090909091","0.057227513227513224","2.0","female","And that's why it was so intense."
"557","00:30:59,600","00:31:06,947","7.347","0.08073626373626375","0.07559788359788361","1.5","female","And here someone runs and says, Yeltsin came, we need a taxi, we need to go to the airport."
"558","00:31:07,441","00:31:13,441","6.0","0.09230769230769231","0.08321693121693122","1.3","female","And we all jump, hands in our pockets and on the table like this."
"559","00:31:14,838","00:31:19,841","5.003","0.10210204081632654","0.09532275132275132","1.2","female","We threw it away because it's 20 cents, 50 cents,"
"560","00:31:19,865","00:31:23,600","3.735","0.093375","0.08321693121693122","1.3","female","30, 50 cents, well, something like that."
"561","00:31:23,600","00:31:28,028","4.428","0.13023529411764706","0.1131005291005291","1.0","female","I was the last one to throw money."
"562","00:31:28,053","00:31:36,793","8.74","0.11653333333333334","0.1131005291005291","1.0","female","Such a small pile of these squashed rubles, and an oppressive silence fell."
"563","00:31:36,818","00:31:41,568","4.75","0.055232558139534885","0.054603174603174605","2.1","female","The whole hall of this dining room, because it's not a restaurant, it's a dining room,"
"564","00:31:41,593","00:31:44,174","2.581","0.0782121212121212","0.07559788359788361","1.5","female","the waiters ran out, all of them."
"565","00:31:44,992","00:31:49,141","4.149","0.08135294117647059","0.07559788359788361","1.5","female","Because for them, still, 200 rubles salary is good."
"566","00:31:50,002","00:31:52,050","2.048","0.043574468085106385","0.0452063492063492","2.5","female","And we threw away, probably, a thousand rubles."
"567","00:31:52,075","00:31:56,839","4.764","0.08357894736842106","0.08321693121693122","1.3","female","And a thousand rubles was there, 3 dollars, for 7 people."
"568","00:31:57,705","00:32:02,859","5.154","0.07809090909090909","0.07559788359788361","1.5","female","And we threw it away and ran away, it's not money, it's not money."
"569","00:32:04,259","00:32:06,951","2.692","0.07691428571428571","0.07559788359788361","1.5","female","Then I flew to Georgia for the war."
"570","00:32:06,976","00:32:12,169","5.193","0.0851311475409836","0.08321693121693122","1.3","female","I just had a translator on the table, and there was a driver."
"571","00:32:12,194","00:32:18,291","6.097","0.08022368421052632","0.07559788359788361","1.5","female","And I put a thousand rubles on the table, I say, to eat, to order something."
"572","00:32:18,316","00:32:22,101","3.785","0.0742156862745098","0.07144973544973544","1.6","female","And they also looked at me, wow, a thousand rubles."
"573","00:32:22,600","00:32:26,292","3.692","0.0802608695652174","0.07559788359788361","1.5","female","And it's nothing, it's 5 dollars or 4 dollars."
"574","00:32:26,600","00:32:31,363","4.763","0.10584444444444444","0.10302645502645504","1.1","female","Well, and we came, yes, really talked, we saw"
"575","00:32:31,388","00:32:35,388","4.0","0.06349206349206349","0.060783068783068786","1.9","female","Shushkevych, we saw Yeltsin, I think I even asked some of them."
"576","00:32:35,413","00:32:37,413","2.0","0.07407407407407407","0.07144973544973544","1.6","female","How close were you to them?"
"577","00:32:37,893","00:32:40,514","2.621","0.09360714285714286","0.08321693121693122","1.3","female","Well, then there was no ban."
"578","00:32:40,983","00:32:48,047","7.064","0.11972881355932204","0.1131005291005291","1.0","female","Then to stand next to Yeltsin is, well, as we sit with you."
"579","00:32:48,600","00:32:55,600","7.0","0.08860759493670886","0.08321693121693122","1.3","female","Well, the only thing is that there was protection, but it was much easier then."
"580","00:32:58,012","00:33:02,352","4.34","0.07233333333333333","0.07144973544973544","1.6","female","On the airfield, in Kyiv, everywhere we met near the stairs."
"581","00:33:02,853","00:33:03,853","1.0","0.07142857142857142","0.06755555555555556","1.7","female","It was normal."
"582","00:33:03,878","00:33:07,878","4.0","0.0625","0.060783068783068786","1.9","female","Then already during Kuchma's time,  it began to change a little."
"583","00:33:07,903","00:33:11,511","3.608","0.05305882352941177","0.05147089947089947","2.2","female","During Kravchuk's tie, you just came, oh, you're a journalist? Okay."
"584","00:33:11,536","00:33:14,826","3.29","0.05483333333333333","0.054603174603174605","2.1","female","Was it a ritual thing, they had already signed an agreement?"
"585","00:33:14,851","00:33:17,244","2.393","0.053177777777777775","0.05147089947089947","2.2","female","No, then we figured out everything as it was."
"586","00:33:18,020","00:33:25,318","7.298","0.09009876543209877","0.08321693121693122","1.3","female","Nobody, just one person of us all, got there in Viskuli, or where they signed it."
"587","00:33:25,790","00:33:37,935","12.145","0.13801136363636363","0.13104761904761905","0.9","female","The beginning was like this. Yeltsin brought a document, laid it on the table, and said,"
"588","00:33:39,351","00:33:49,176","9.825","0.12596153846153846","0.1131005291005291","1.0","female","'Leonid Makarovich, you can do whatever you want, mark it, change it, mark it,"
"589","00:33:49,200","00:33:52,920","3.72","0.058125","0.057227513227513224","2.0","female","write it down, do whatever you want, but you have to accept it.'"
"590","00:33:54,543","00:34:00,551","6.008","0.09849180327868852","0.09532275132275132","1.2","female","Kravchuk said, 'You know, a week ago, I was elected president"
"591","00:34:00,575","00:34:03,960","3.385","0.054596774193548386","0.05147089947089947","2.2","female","with the pre-election program for the independence of Ukraine."
"592","00:34:04,416","00:34:07,907","3.491","0.06982000000000001","0.06755555555555556","1.7","female","It was somehow strange that was now for the Union."
"593","00:34:07,931","00:34:10,600","2.669","0.058021739130434784","0.057227513227513224","2.0","female","A week ago, I was against the Union, and now'"
"594","00:34:11,163","00:34:15,748","4.585","0.10916666666666666","0.10302645502645504","1.1","female","And then this phrase came up in the sauna."
"595","00:34:15,772","00:34:18,501","2.729","0.05685416666666667","0.054603174603174605","2.1","female","In the sauna, not because they were naked there,"
"596","00:34:18,525","00:34:21,080","2.555","0.04188524590163935","0.0452063492063492","2.5","female","it's not the top officials, but the country's second persons."
"597","00:34:21,080","00:34:22,840","1.76","0.060689655172413794","0.057227513227513224","2.0","female","It was just that it was free."
"598","00:34:22,840","00:34:27,320","4.48","0.08960000000000001","0.08321693121693122","1.3","female","They just came in in suits, there was just a room."
"599","00:34:28,237","00:34:33,860","5.623","0.09371666666666667","0.08321693121693122","1.3","female","And there, this geopolitical reality of the previously named"
"600","00:34:33,885","00:34:38,574","4.689","0.09017307692307693","0.08321693121693122","1.3","female","Union of Soviet Socialist Republics ceases to exist."
"601","00:34:39,369","00:34:42,228","2.859","0.06807142857142857","0.06755555555555556","1.7","female","It's just that they thought for two hours,"
"602","00:34:42,252","00:34:44,502","2.25","0.05232558139534884","0.05147089947089947","2.2","female","and the phrase 'geopolitical reality of the"
"603","00:34:44,525","00:34:49,400","4.874","0.06962857142857143","0.06755555555555556","1.7","female","previously named Union of Soviet Socialist Republics ceases to exist.'"
"604","00:34:49,400","00:34:51,639","2.24","0.0973913043478261","0.09532275132275132","1.2","female","And then it got easier."
"605","00:34:51,639","00:34:52,600","0.96","0.24","0.23602116402116402","0.5","female","Yes."
"606","00:34:52,600","00:34:55,788","3.188","0.07413953488372094","0.07144973544973544","1.6","female","But it all started only when Kravchuk said,"
"607","00:34:55,812","00:35:01,400","5.588","0.09978571428571428","0.09532275132275132","1.2","female","'No, no, no, guys, we're not joking here, it's serious.'"
"608","00:35:02,219","00:35:06,188","3.969","0.070875","0.06755555555555556","1.7","female","Integral nationalists spoke out against it here in Kyiv,"
"609","00:35:06,212","00:35:10,548","4.336","0.15485714285714286","0.1423068783068783","0.8","female","like Stepan Ilkovich Khmara,"
"610","00:35:10,572","00:35:18,732","8.16","0.15692307692307692","0.1423068783068783","0.8","female","and Chornovyl... there was a lot of diversity there."
"611","00:35:18,757","00:35:26,489","7.732","0.09545679012345679","0.09532275132275132","1.2","female","Why, Mykola, didn't we make such a quantum jump with little blood as Baltica did?"
"612","00:35:27,128","00:35:28,359","1.231","0.0769375","0.07559788359788361","1.5","female","It's impossible."
"613","00:35:28,383","00:35:29,224","0.841","0.21025","0.1903915343915344","0.6","female","Why?"
"614","00:35:29,248","00:35:31,248","2.0","0.05714285714285714","0.054603174603174605","2.1","female","It`s all just conversations that..."
"615","00:35:31,933","00:35:35,385","3.452","0.12328571428571429","0.1131005291005291","1.0","female","Because the Baltic States..."
"616","00:35:35,911","00:35:39,167","3.256","0.09302857142857142","0.08321693121693122","1.3","female","Well, you will be guilty, not me..."
"617","00:35:39,725","00:35:41,325","1.6","0.0761904761904762","0.07559788359788361","1.5","female","We are not Europeans."
"618","00:35:41,436","00:35:45,149","3.713","0.05017567567567568","0.049439153439153435","2.3","female","The Baltics considered themselves from the very beginning to be Europeans,"
"619","00:35:45,173","00:35:48,353","3.18","0.09636363636363637","0.09532275132275132","1.2","female","we became Europeans only in 2014."
"620","00:35:48,996","00:35:52,262","3.266","0.09605882352941177","0.09532275132275132","1.2","female","But now we paved the path somehow."
"621","00:35:52,960","00:35:56,988","4.028","0.3356666666666666","0.29079365079365077","0.3","female","Estonians..."
"622","00:35:57,012","00:36:01,817","4.805","0.120125","0.1131005291005291","1.0","female","I was in Estonia in 1976 with my father."
"623","00:36:01,841","00:36:02,943","1.102","0.038000000000000006","0.0452063492063492","2.5","female","I was walking around Tallinn."
"624","00:36:02,968","00:36:10,078","7.11","0.08670731707317074","0.08321693121693122","1.3","female","There was a home cathedral in every capital. And I came up to go on and they said,"
"625","00:36:10,200","00:36:18,200","8.0","0.11764705882352941","0.1131005291005291","1.0","female","''Excuse me, please, we are already closed. Do you want something?''"
"626","00:36:18,200","00:36:22,200","4.0","0.07272727272727272","0.07144973544973544","1.6","female","I said, ''Yes, I would like to... Where are you from?''"
"627","00:36:23,404","00:36:25,200","1.796","0.06907692307692308","0.06755555555555556","1.7","female","I said, ''I'm from Kyiv.''"
"628","00:36:25,200","00:36:28,200","3.0","0.08108108108108109","0.07559788359788361","1.5","female","''What language do you speak there?''"
"629","00:36:28,200","00:36:29,730","1.53","0.06954545454545455","0.06755555555555556","1.7","female","I said, ''Ukrainian.''"
"630","00:36:30,032","00:36:32,032","2.0","0.1","0.09532275132275132","1.2","female","''Please, come in.''"
"631","00:36:32,389","00:36:34,200","1.811","0.1131875","0.1131005291005291","1.0","female","Forest brothers."
"632","00:36:34,200","00:36:36,200","2.0","0.1","0.09532275132275132","1.2","female","That's the question."
"633","00:36:37,206","00:36:40,200","2.994","0.06962790697674419","0.06755555555555556","1.7","female","I lied because in Kyiv Ukrainian is... Yes."
"634","00:36:40,200","00:36:41,200","1.0","0.06666666666666667","0.06425396825396826","1.8","female","Yes, of course."
"635","00:36:41,200","00:36:46,200","5.0","0.060240963855421686","0.057227513227513224","2.0","female","It was used by 0.5%. But I understood because I was already trained in nationalism."
"636","00:36:46,200","00:36:49,200","3.0","0.04285714285714286","0.0452063492063492","2.5","female","Did your father speak Ukrainian or Russian at the Academy of Sciences?"
"637","00:36:49,200","00:36:50,794","1.594","0.05313333333333334","0.05147089947089947","2.2","female","It's also a complicated story."
"638","00:36:50,819","00:36:55,018","4.199","0.08398","0.08321693121693122","1.3","female","While there was Shelest, everyone spoke Ukrainian."
"639","00:36:56,260","00:37:01,200","4.94","0.08517241379310346","0.08321693121693122","1.3","female","The plenum of the Central Committee was held in Ukrainian."
"640","00:37:01,200","00:37:02,200","1.0","0.14285714285714285","0.1423068783068783","0.8","female","Really?"
"641","00:37:02,200","00:37:02,800","0.6","0.15","0.1423068783068783","0.8","female","Yes."
"642","00:37:03,105","00:37:08,761","5.656","0.06897560975609755","0.06755555555555556","1.7","female","Until 1972, the plenums of the Central Committee during Shelest were in Ukrainian."
"643","00:37:09,721","00:37:17,200","7.479","0.09972","0.09532275132275132","1.2","female","Then Shcherbitsky came and gradually, then Malanchuk, this famous Lviv guy."
"644","00:37:17,200","00:37:19,287","2.087","0.05090243902439025","0.049439153439153435","2.3","female","I had a fight with him twice, by the way."
"645","00:37:20,200","00:37:23,200","3.0","0.07894736842105263","0.07559788359788361","1.5","female","With the main enemy of all of Ukraine."
"646","00:37:23,200","00:37:26,200","3.0","0.06818181818181818","0.06755555555555556","1.7","female","It's very strange that he is from Halychyna."
"647","00:37:26,200","00:37:28,200","2.0","0.07692307692307693","0.07559788359788361","1.5","female","He is from Galichina, yes."
"648","00:37:28,200","00:37:35,200","7.0","0.1346153846153846","0.13104761904761905","0.9","female","And that's why they always didn't want to be Soviet."
"649","00:37:35,550","00:37:41,629","6.079","0.07894805194805195","0.07559788359788361","1.5","female","And here, apart from Galichina, Volhynia, Bukovina... Was there any strategy?"
"650","00:37:41,654","00:37:45,948","4.294","0.08763265306122447","0.08321693121693122","1.3","female","Well, look, if in the Baltic states, for example,"
"651","00:37:45,972","00:37:49,859","3.887","0.06819298245614035","0.06755555555555556","1.7","female","this umbilical cord was not cut by the so-called Soviets,"
"652","00:37:49,884","00:37:53,248","3.364","0.04153086419753086","0.0452063492063492","2.5","female","and they remembered it, and it was important for them as a language, and so on..."
"653","00:37:53,273","00:37:57,200","3.927","0.0714","0.06755555555555556","1.7","female","Forty years ago, not all of them died, not all of them."
"654","00:37:57,200","00:37:58,200","1.0","0.1","0.09532275132275132","1.2","female","Well, yes."
"655","00:37:58,200","00:38:03,296","5.096","0.06794666666666667","0.06755555555555556","1.7","female","And in our country, especially in Halychyna, at least the Bandera movement,"
"656","00:38:03,321","00:38:08,005","4.684","0.1201025641025641","0.1131005291005291","1.0","female","what about in Kyiv, Kharkiv, and Odesa?"
"657","00:38:08,030","00:38:11,200","3.17","0.04953125","0.049439153439153435","2.3","female","I understand that they had more dissidents in the Baltic states."
"658","00:38:11,200","00:38:13,200","2.0","0.07142857142857142","0.06755555555555556","1.7","female","They didn't have dissidents."
"659","00:38:13,200","00:38:14,383","1.183","0.039433333333333334","0.0452063492063492","2.5","female","It's a very complicated issue."
"660","00:38:14,408","00:38:17,175","2.767","0.05220754716981132","0.05147089947089947","2.2","female","The statistics there seem to be Ukrainian and Baltic."
"661","00:38:17,200","00:38:19,668","2.468","0.044071428571428574","0.0452063492063492","2.5","female","The question is that the Baltics themselves once told me"
"662","00:38:19,692","00:38:21,200","1.508","0.04864516129032258","0.04791534391534392","2.4","female","that they all are nationalists."
"663","00:38:21,200","00:38:22,882","1.682","0.048057142857142854","0.04791534391534392","2.4","female","We don't have any non-nationalists."
"664","00:38:23,470","00:38:27,200","3.73","0.05567164179104478","0.054603174603174605","2.1","female","Unlike the Ukrainians, not all of them are nationalists in Ukraine."
"665","00:38:27,200","00:38:31,740","4.54","0.0463265306122449","0.0452063492063492","2.5","female","But if they are already nationalists, they're so passionate that we still need to learn from them,"
"666","00:38:32,200","00:38:34,200","2.0","0.058823529411764705","0.057227513227513224","2.0","female","Because they are all a little bit."
"667","00:38:34,200","00:38:35,200","1.0","0.037037037037037035","0.0452063492063492","2.5","female","And a little bit like this."
"668","00:38:35,200","00:38:37,645","2.445","0.07887096774193549","0.07559788359788361","1.5","female","And what language do you speak?"
"669","00:38:38,056","00:38:41,708","3.652","0.0664","0.06425396825396826","1.8","female","And if Ukraine becomes a nationalist, then we will burn"
"670","00:38:41,732","00:38:43,796","2.064","0.0688","0.06755555555555556","1.7","female","the commandments of the Party."
"671","00:38:44,200","00:38:45,780","1.58","0.05642857142857143","0.054603174603174605","2.1","female","That's why it was like that."
"672","00:38:45,805","00:38:53,026","7.221","0.08596428571428572","0.08321693121693122","1.3","female","In 1991, the communists voted for the creation of another state, of course, Ukraine."
"673","00:38:53,200","00:38:55,200","2.0","0.08333333333333333","0.08321693121693122","1.3","female","And what is the concept?"
"674","00:38:55,200","00:38:57,019","1.819","0.06737037037037037","0.06425396825396826","1.8","female","How do they see this state?"
"675","00:38:57,044","00:38:58,044","1.0","0.05263157894736842","0.05147089947089947","2.2","female","What did they want?"
"676","00:38:58,069","00:39:00,069","2.0","0.08","0.07559788359788361","1.5","female","They didn't see anything."
"677","00:39:00,094","00:39:01,094","1.0","0.058823529411764705","0.057227513227513224","2.0","female","They had to hide."
"678","00:39:01,119","00:39:02,119","1.0","0.03333333333333333","0.0452063492063492","2.5","female","This is the same conversation."
"679","00:39:02,144","00:39:03,144","1.0","0.06666666666666667","0.06425396825396826","1.8","female","Look, 33 years."
"680","00:39:03,169","00:39:05,169","2.0","0.058823529411764705","0.057227513227513224","2.0","female","We are standing next to that post."
"681","00:39:05,200","00:39:06,200","1.0","0.04","0.0452063492063492","2.5","female","And we are talking again."
"682","00:39:06,200","00:39:10,988","4.788","0.09576000000000001","0.09532275132275132","1.2","female","We will keep talking until the generation changes."
"683","00:39:11,694","00:39:17,268","5.574","0.19220689655172413","0.1903915343915344","0.6","female","When Yosep Zisels teaches us,"
"684","00:39:17,292","00:39:21,200","3.908","0.06856140350877193","0.06755555555555556","1.7","female","when I talk to him, I say, Yosep, you are a smart person."
"685","00:39:21,200","00:39:22,200","1.0","0.05","0.049439153439153435","2.3","female","You know everything."
"686","00:39:22,200","00:39:25,200","3.0","0.05357142857142857","0.05147089947089947","2.2","female","You were in prison for nationalism with such a nickname."
"687","00:39:25,200","00:39:28,805","3.605","0.08193181818181818","0.07559788359788361","1.5","female","And he says, well, it's the same as we have."
"688","00:39:28,830","00:39:32,980","4.15","0.05684931506849315","0.054603174603174605","2.1","female","He says, I mean, when they say 40 years, they were walking in the desert."
"689","00:39:33,200","00:39:34,641","1.441","0.07584210526315789","0.07559788359788361","1.5","female","So we are the same."
"690","00:39:34,666","00:39:36,981","2.315","0.051444444444444445","0.049439153439153435","2.3","female","I say, what do you mean, he says, well, look,"
"691","00:39:37,005","00:39:40,569","3.564","0.06988235294117646","0.06755555555555556","1.7","female","in the 90s, 10 years, the communists were in power."
"692","00:39:41,569","00:39:44,768","3.199","0.12303846153846153","0.1131005291005291","1.0","female","The 00s - Komsomol people."
"693","00:39:45,200","00:39:48,200","3.0","0.15789473684210525","0.1423068783068783","0.8","female","The 10s - pioneers."
"694","00:39:48,435","00:39:50,729","2.294","0.06747058823529412","0.06425396825396826","1.8","female","We have to survive the Octobrists."
"695","00:39:51,200","00:39:52,951","1.751","0.06037931034482758","0.057227513227513224","2.0","female","And now you are 40 years old."
"696","00:39:54,200","00:39:59,634","5.434","0.07057142857142858","0.06755555555555556","1.7","female","So now we still have 5 years, 4 years, 6 years, and we will almost lose them."
"697","00:40:00,200","00:40:01,200","1.0","0.2","0.1903915343915344","0.6","female","Here."
"698","00:40:01,200","00:40:03,200","2.0","0.05555555555555555","0.054603174603174605","2.1","female","What did they want from the country?"
"699","00:40:03,200","00:40:05,200","2.0","0.08695652173913043","0.08321693121693122","1.3","female","They were running away."
"700","00:40:05,200","00:40:08,200","3.0","0.06666666666666667","0.06425396825396826","1.8","female","I was one of the few, even among journalists."
"701","00:40:08,200","00:40:14,200","6.0","0.08823529411764706","0.08321693121693122","1.3","female","I went down to the cinema hall of the Verkhovna Rada on August 24th,"
"702","00:40:14,200","00:40:19,200","5.0","0.060240963855421686","0.057227513227513224","2.0","female","where the communists were going to decide how to vote for them on Independence Day."
"703","00:40:20,460","00:40:24,026","3.566","0.08915","0.08321693121693122","1.3","female","And I realized that the concept is this."
"704","00:40:24,962","00:40:27,200","2.238","0.054585365853658536","0.05147089947089947","2.2","female","There is a quiet life here, more or less."
"705","00:40:28,428","00:40:32,851","4.423","0.06601492537313433","0.06425396825396826","1.8","female","Kravchuk, the second secretary of the Central Committee, is a head."
"706","00:40:33,502","00:40:37,448","3.946","0.08578260869565217","0.08321693121693122","1.3","female","And what Yeltsin will do there, we don't know."
"707","00:40:37,473","00:40:40,200","2.727","0.043983870967741936","0.0452063492063492","2.5","female","And we are afraid of him because he is such an anti-communist."
"708","00:40:41,436","00:40:44,880","3.444","0.084","0.08321693121693122","1.3","female","And let's separate and protect ourselves."
"709","00:40:46,843","00:40:51,200","4.357","0.050662790697674424","0.049439153439153435","2.3","female","In Moscow, they will ban the Communist Party and maybe they will all be put in prison."
"710","00:40:51,200","00:40:52,200","1.0","0.058823529411764705","0.057227513227513224","2.0","female","Nobody knew then."
"711","00:40:52,200","00:40:56,200","4.0","0.08695652173913043","0.08321693121693122","1.3","female","Whether they will ban or not, imprison or not."
