"Number","Start Time","End Time","Duration","Symbol Duration","TTS Symbol Duration","TTS Speed Closest","Speaker","Text"
"1787","01:41:17,200","01:41:17,799","0.599","0.19966666666666666","0.1903915343915344","0.6","female","No."
"1788","01:41:17,824","01:41:19,824","2.0","0.044444444444444446","0.0452063492063492","2.5","female","He definitely has more information than I do."
"1789","01:41:20,200","01:41:23,200","3.0","0.125","0.1131005291005291","1.0","female","Let him see it that way."
"1790","01:41:23,200","01:41:30,200","7.0","0.10144927536231885","0.09532275132275132","1.2","female","Now the question is, if Trump wins,  will anything change or nothing?"
"1791","01:41:30,972","01:41:35,155","4.183","0.11305405405405405","0.10302645502645504","1.1","female","If they give these 60 billion or not,"
"1792","01:41:36,200","01:41:40,837","4.637","0.09092156862745097","0.08321693121693122","1.3","female","will we withstand the pressure on the front or not?"
"1793","01:41:41,200","01:41:47,200","6.0","0.08695652173913043","0.08321693121693122","1.3","female","Can we mobilize, well, okay, not 500,000, but 400,000, okay, 300,000?"
"1794","01:41:47,200","01:41:48,163","0.963","0.06878571428571428","0.06755555555555556","1.7","female","Or can we not?"
"1795","01:41:50,060","01:41:51,200","1.14","0.049565217391304345","0.049439153439153435","2.3","female","That's just a question."
"1796","01:41:51,200","01:41:53,200","2.0","0.038461538461538464","0.0452063492063492","2.5","female","Do you think that the conversation with the country,"
"1797","01:41:53,200","01:41:57,200","4.0","0.05405405405405406","0.05147089947089947","2.2","female","if the government comes out and says that we do not withstand the pressure"
"1798","01:41:57,200","01:42:03,640","6.44","0.08151898734177215","0.07559788359788361","1.5","female","and we will stop in deep defense, will it end with the consolidation of society"
"1799","01:42:03,665","01:42:10,175","6.51","0.07939024390243903","0.07559788359788361","1.5","female","and the preservation of that part of Ukraine that was liberated from the Russians?"
"1800","01:42:10,200","01:42:14,200","4.0","0.08888888888888889","0.08321693121693122","1.3","female","Difficult. The conversation will not be easy."
"1801","01:42:14,539","01:42:17,200","2.661","0.054306122448979595","0.05147089947089947","2.2","female","Will the country survive after this conversation?"
"1802","01:42:17,200","01:42:22,200","5.0","0.09090909090909091","0.08321693121693122","1.3","female","Listen, our problem, the problem of Ukrainians is that,"
"1803","01:42:22,200","01:42:29,200","7.0","0.07865168539325842","0.07559788359788361","1.5","female","and, by the way, journalists, and you, and me, it is that we, looking at social networks,"
"1804","01:42:30,313","01:42:39,200","8.887","0.10333720930232558","0.10302645502645504","1.1","female","see there are 3-5, a maximum of 7 percent, but so active, who are constantly shouting,"
"1805","01:42:39,200","01:42:42,980","3.78","0.05641791044776119","0.054603174603174605","2.1","female","everything is gone, they take off their clothes, the client leaves."
"1806","01:42:44,200","01:42:47,200","3.0","0.07894736842105263","0.07559788359788361","1.5","female","Do you think it's 3-5 percent of them?"
"1807","01:42:47,200","01:42:49,200","2.0","0.043478260869565216","0.0452063492063492","2.5","female","I don't think so, I'm talking to sociologists."
"1808","01:42:49,200","01:42:51,200","2.0","0.05128205128205128","0.049439153439153435","2.3","female","I'm talking to sociologists on purpose."
"1809","01:42:51,200","01:42:53,964","2.764","0.06142222222222222","0.060783068783068786","1.9","female","People are much wiser, they just keep silent."
"1810","01:42:53,989","01:42:56,989","3.0","0.05172413793103448","0.05147089947089947","2.2","female","Those who are wiser, who are 80 percent, they keep silent."
"1811","01:42:57,200","01:43:01,464","4.264","0.05762162162162163","0.057227513227513224","2.0","female","And those who speak from morning to night, that everyone around is guilty,"
"1812","01:43:02,551","01:43:05,551","3.0","0.07894736842105263","0.07559788359788361","1.5","female","there are 3-5, a maximum of 7 of them."
"1813","01:43:05,576","01:43:10,200","4.624","0.06422222222222222","0.060783068783068786","1.9","female","But there are so many of them, they are so bright, they shout so loudly."
"1814","01:43:10,200","01:43:13,200","3.0","0.05357142857142857","0.05147089947089947","2.2","female","Natalka, it's all right, Ukrainians are not such idiots."
"1815","01:43:13,200","01:43:15,426","2.226","0.04122222222222222","0.0452063492063492","2.5","female","Although there are, they happen, there are, there are."
"1816","01:43:16,672","01:43:20,200","3.528","0.046421052631578946","0.0452063492063492","2.5","female","That is, you don't have such a feeling of a deep split in Ukrainian society?"
"1817","01:43:20,200","01:43:23,200","3.0","0.06382978723404255","0.060783068783068786","1.9","female","There is nothing close, there is nothing close."
"1818","01:43:23,886","01:43:28,200","4.314","0.07311864406779661","0.07144973544973544","1.6","female","And in Lviv, where you live, there is no such thing either?"
"1819","01:43:29,014","01:43:31,200","2.186","0.04752173913043478","0.0452063492063492","2.5","female","Listen, there are different people everywhere."
"1820","01:43:31,200","01:43:37,396","6.196","0.14081818181818181","0.13104761904761905","0.9","female","That is, here I am, we began to donate less."
"1821","01:43:37,421","01:43:39,200","1.779","0.07116","0.06755555555555556","1.7","female","I'm talking to the banks."
"1822","01:43:39,943","01:43:42,200","2.257","0.04906521739130435","0.04791534391534392","2.4","female","Well, Gorokhovsky came out and said more, yes."
"1823","01:43:42,200","01:43:46,200","4.0","0.06349206349206349","0.060783068783068786","1.9","female","In one and a half times, the 2023 year gave more than the 2022."
"1824","01:43:47,205","01:43:49,200","1.995","0.0665","0.06425396825396826","1.8","female","What kind of nonsense is this?"
"1825","01:43:49,200","01:43:52,200","3.0","0.04054054054054054","0.0452063492063492","2.5","female","Someone, to someone, one woman, the woman said, as they say about the BBC."
"1826","01:43:53,190","01:43:58,562","5.372","0.068","0.06755555555555556","1.7","female","Here I read, everyone stopped speaking the Ukrainian language, back to Russian."
"1827","01:43:58,587","01:44:00,873","2.286","0.060157894736842105","0.057227513227513224","2.0","female","We didn`t all speak totally Ukrainian,"
"1828","01:44:00,898","01:44:03,898","3.0","0.05357142857142857","0.05147089947089947","2.2","female","in the 2022 year we suddenly had such a magical tummler."
"1829","01:44:04,672","01:44:06,918","2.246","0.08638461538461538","0.08321693121693122","1.3","female","And 100% speaks Ukrainian."
"1830","01:44:06,943","01:44:09,943","3.0","0.06818181818181818","0.06755555555555556","1.7","female","No, they will speak Russian for a long time."
"1831","01:44:10,652","01:44:13,200","2.548","0.06533333333333334","0.06425396825396826","1.8","female","There are places where they will speak."
"1832","01:44:13,200","01:44:15,200","2.0","0.06896551724137931","0.06755555555555556","1.7","female","And you will not go anywhere."
"1833","01:44:15,200","01:44:17,200","2.0","0.06060606060606061","0.057227513227513224","2.0","female","You will not do anything with it."
"1834","01:44:17,200","01:44:19,200","2.0","0.1","0.09532275132275132","1.2","female","Nature is like that."
"1835","01:44:19,665","01:44:21,200","1.535","0.07309523809523809","0.07144973544973544","1.6","female","This is how we lived."
"1836","01:44:21,200","01:44:23,200","2.0","0.07692307692307693","0.07559788359788361","1.5","female","So I don`t see any splits."
"1837","01:44:23,200","01:44:27,200","4.0","0.10810810810810811","0.10302645502645504","1.1","female","Yes, I think I can greet the Kremlin."
"1838","01:44:27,200","01:44:28,200","1.0","0.041666666666666664","0.0452063492063492","2.5","female","Because this is gradual."
"1839","01:44:28,200","01:44:30,200","2.0","0.06451612903225806","0.06425396825396826","1.8","female","Here it is bad, here it is bad."
"1840","01:44:30,200","01:44:32,200","2.0","0.11764705882352941","0.1131005291005291","1.0","female","Everyone shouted."
"1841","01:44:32,200","01:44:34,200","2.0","0.05263157894736842","0.05147089947089947","2.2","female","They take off their clothes and leave."
"1842","01:44:34,200","01:44:36,200","2.0","0.14285714285714285","0.1423068783068783","0.8","female","And that's it."
"1843","01:44:36,200","01:44:38,200","2.0","0.0625","0.060783068783068786","1.9","female","You know, it's probably the age."
"1844","01:44:38,200","01:44:43,200","5.0","0.09803921568627451","0.09532275132275132","1.2","female","I have long said that everyone who is on the stage,"
"1845","01:44:43,200","01:44:46,200","3.0","0.07692307692307693","0.07559788359788361","1.5","female","they all need them, Ukraine needs them."
"1846","01:44:47,088","01:44:49,200","2.112","0.0704","0.06755555555555556","1.7","female","The nation itself will choose."
"1847","01:44:49,200","01:44:51,200","2.0","0.1","0.09532275132275132","1.2","female","These are elections."
"1848","01:44:51,200","01:44:52,596","1.396","0.04653333333333333","0.0452063492063492","2.5","female","We can't do anything about it."
"1849","01:44:52,621","01:44:58,175","5.554","0.069425","0.06755555555555556","1.7","female","When they started..., I read today that some idiots, I will not say their names,"
"1850","01:44:58,200","01:45:00,200","2.0","0.06666666666666667","0.06425396825396826","1.8","female","they were very serious idiots."
"1851","01:45:00,826","01:45:02,200","1.374","0.06870000000000001","0.06755555555555556","1.7","female","Usurpation of power."
"1852","01:45:02,200","01:45:09,200","7.0","0.08860759493670886","0.08321693121693122","1.3","female","I say, listen, the people came and said, this guy has 73%, these guys have 50%."
"1853","01:45:09,200","01:45:11,200","2.0","0.16666666666666666","0.16228571428571428","0.7","female","23% and 70%."
"1854","01:45:11,200","01:45:12,200","1.0","0.09090909090909091","0.08321693121693122","1.3","female","No, no, no."
"1855","01:45:12,200","01:45:14,200","2.0","0.05405405405405406","0.05147089947089947","2.2","female","I'm not talking about the parliament."
"1856","01:45:14,200","01:45:16,200","2.0","0.07142857142857142","0.06755555555555556","1.7","female","There are 50% and something."
"1857","01:45:16,200","01:45:19,772","3.572","0.13738461538461538","0.13104761904761905","0.9","female","Well, let's cancel it all."
"1858","01:45:20,083","01:45:21,200","1.117","0.04137037037037037","0.0452063492063492","2.5","female","Well, that's what happened."
"1859","01:45:21,200","01:45:23,200","2.0","0.08695652173913043","0.08321693121693122","1.3","female","People voted like that."
"1860","01:45:23,200","01:45:24,200","1.0","0.08333333333333333","0.08321693121693122","1.3","female","This is bad."
"1861","01:45:24,200","01:45:25,200","1.0","0.1","0.09532275132275132","1.2","female","Well, bad."
"1862","01:45:25,200","01:45:26,200","1.0","0.07692307692307693","0.07559788359788361","1.5","female","I don't know."
"1863","01:45:26,200","01:45:28,200","2.0","0.06896551724137931","0.06755555555555556","1.7","female","But these are people, not me."
"1864","01:45:28,789","01:45:31,200","2.411","0.06888571428571429","0.06755555555555556","1.7","female","I, for example, didn't vote for it."
"1865","01:45:32,782","01:45:38,200","5.418","0.05953846153846154","0.057227513227513224","2.0","female","But I, well, if it's a democracy, do I have to agree with the majority or what should I do?"
"1866","01:45:38,200","01:45:39,892","1.692","0.0846","0.08321693121693122","1.3","female","How should I behave?"
"1867","01:45:40,200","01:45:42,200","2.0","0.05263157894736842","0.05147089947089947","2.2","female","Raise the revolution every five years."
"1868","01:45:42,200","01:45:44,200","2.0","0.05555555555555555","0.054603174603174605","2.1","female","Because I don't like this president."
"1869","01:45:44,200","01:45:45,200","1.0","0.038461538461538464","0.0452063492063492","2.5","female","I don't like this council."
"1870","01:45:45,200","01:45:47,200","2.0","0.06060606060606061","0.057227513227513224","2.0","female","I don't like this prime minister."
"1871","01:45:47,200","01:45:49,036","1.836","0.05563636363636364","0.054603174603174605","2.1","female","I don't like these people at all."
"1872","01:45:49,061","01:45:52,061","3.0","0.07692307692307693","0.07559788359788361","1.5","female","Churchill told us that it was very bad."
"1873","01:45:52,200","01:45:55,200","3.0","0.075","0.07144973544973544","1.6","female","Democracy is very, very, very imperfect."
"1874","01:45:55,200","01:45:56,790","1.59","0.041842105263157896","0.0452063492063492","2.5","female","It's better to come up with something."
"1875","01:45:57,200","01:45:58,200","1.0","0.037037037037037035","0.0452063492063492","2.5","female","Let's do it like in Moscow."
"1876","01:45:58,200","01:45:59,107","0.907","0.03628","0.0452063492063492","2.5","female","Everything is fine there."
"1877","01:45:59,811","01:46:03,175","3.364","0.05096969696969697","0.049439153439153435","2.3","female","The man came and said, here you will be like this, walk as I said."
"1878","01:46:03,413","01:46:04,678","1.265","0.09035714285714284","0.08321693121693122","1.3","female","And that's it."
"1879","01:46:05,200","01:46:09,925","4.725","0.05762195121951219","0.057227513227513224","2.0","female","And by the way, a lot of people, these 7%, about whom I said, this is their dream."
"1880","01:46:10,200","01:46:12,200","2.0","0.05714285714285714","0.054603174603174605","2.1","female","I'm just saying, what are they for?"
"1881","01:46:12,200","01:46:13,200","1.0","0.043478260869565216","0.0452063492063492","2.5","female","They are for democracy."
"1882","01:46:13,200","01:46:14,200","1.0","0.09090909090909091","0.08321693121693122","1.3","female","No, no, no."
"1883","01:46:14,200","01:46:16,474","2.274","0.06497142857142857","0.06425396825396826","1.8","female","They want everyone to be like them."
"1884","01:46:18,025","01:46:20,025","2.0","0.08","0.07559788359788361","1.5","female","They want everyone to be."
"1885","01:46:20,200","01:46:23,200","3.0","0.0967741935483871","0.09532275132275132","1.2","female","They don't just write, I think."
"1886","01:46:23,200","01:46:25,200","2.0","0.16666666666666666","0.16228571428571428","0.7","female","People need."
"1887","01:46:25,200","01:46:26,200","1.0","0.25","0.23602116402116402","0.5","female","Yes."
"1888","01:46:26,200","01:46:27,839","1.639","0.06303846153846154","0.060783068783068786","1.9","female","They always have a people."
"1889","01:46:27,864","01:46:28,864","1.0","0.14285714285714285","0.1423068783068783","0.8","female","People."
"1890","01:46:29,857","01:46:34,751","4.894","0.13227027027027027","0.13104761904761905","0.9","female","Savonarola was like that in Florence."
"1891","01:46:36,870","01:46:43,839","6.969","0.07830337078651686","0.07559788359788361","1.5","female","Everyone remembers great artists, sculptors, but there was Savonarola, who was like that."
"1892","01:46:43,864","01:46:46,864","3.0","0.07692307692307693","0.07559788359788361","1.5","female","He had a lot of young guys, very young."
"1893","01:46:46,889","01:46:50,889","4.0","0.09523809523809523","0.08321693121693122","1.3","female","And they just destroyed, attacked, killed."
"1894","01:46:50,914","01:46:54,914","4.0","0.05555555555555555","0.054603174603174605","2.1","female","It would be good to destroy, to attack, to kill, but not during the war."
"1895","01:46:55,200","01:46:59,200","4.0","0.08333333333333333","0.08321693121693122","1.3","female","And so, when I asked you, do you feel the split?"
"1896","01:46:59,200","01:47:01,200","2.0","0.10526315789473684","0.10302645502645504","1.1","female","I'm very triggered."
"1897","01:47:01,200","01:47:02,200","1.0","0.0625","0.060783068783068786","1.9","female","I won't hide it."
"1898","01:47:02,200","01:47:05,200","3.0","0.06818181818181818","0.06755555555555556","1.7","female","And I'm always worried about such movements."
"1899","01:47:05,200","01:47:07,200","2.0","0.045454545454545456","0.0452063492063492","2.5","female","And especially this one, the last discourse."
"1900","01:47:07,200","01:47:08,200","1.0","0.07692307692307693","0.07559788359788361","1.5","female","I don't know."
"1901","01:47:08,200","01:47:12,200","4.0","0.08","0.07559788359788361","1.5","female","Of course, when we go on air, I think it will end."
"1902","01:47:12,200","01:47:18,032","5.832","0.07382278481012658","0.07144973544973544","1.6","female","But nevertheless, I think it's quite dangerous when politicians separate people"
"1903","01:47:18,057","01:47:20,200","2.143","0.05226829268292683","0.05147089947089947","2.2","female","along the lines of Zaluzhny and Zelensky."
"1904","01:47:20,200","01:47:21,200","1.0","0.07142857142857142","0.06755555555555556","1.7","female","Just a second."
"1905","01:47:21,200","01:47:22,200","1.0","0.06666666666666667","0.06425396825396826","1.8","female","It will happen."
"1906","01:47:22,200","01:47:23,200","1.0","0.037037037037037035","0.0452063492063492","2.5","female","What luck for the Russians."
"1907","01:47:23,200","01:47:24,200","1.0","0.09090909090909091","0.08321693121693122","1.3","female","It happens."
"1908","01:47:24,200","01:47:27,098","2.898","0.138","0.13104761904761905","0.9","female","People remain people."
"1909","01:47:27,123","01:47:28,123","1.0","0.045454545454545456","0.0452063492063492","2.5","female","You can't go anywhere."
"1910","01:47:28,148","01:47:29,837","1.689","0.07343478260869565","0.07144973544973544","1.6","female","There will be scandals."
"1911","01:47:29,862","01:47:37,041","7.179","0.08862962962962963","0.08321693121693122","1.3","female","People have gathered during the beginning of the war, as always, in a new affair."
"1912","01:47:37,127","01:47:39,127","2.0","0.05714285714285714","0.054603174603174605","2.1","female","This is not even a military affair."
"1913","01:47:39,152","01:47:41,264","2.112","0.1056","0.10302645502645504","1.1","female","You asked about 1+1."
"1914","01:47:41,289","01:47:49,670","8.381","0.17104081632653062","0.16228571428571428","0.7","female","When 1+1 appeared, everyone was burning brightly."
"1915","01:47:50,138","01:47:51,671","1.533","0.04790625","0.0452063492063492","2.5","female","No one wanted to make a mistake."
"1916","01:47:51,696","01:47:53,491","1.795","0.05609375","0.054603174603174605","2.1","female","Everyone was next to each other."
"1917","01:47:53,516","01:47:55,200","1.684","0.04431578947368421","0.0452063492063492","2.5","female","Everyone was holding on to each other."
"1918","01:47:55,200","01:47:59,200","4.0","0.05970149253731343","0.057227513227513224","2.0","female","Come on, we will now prove that Ukrainians can do great television."
"1919","01:47:59,200","01:48:01,200","2.0","0.08","0.07559788359788361","1.5","female","Let's find such and such."
"1920","01:48:01,200","01:48:03,200","2.0","0.09523809523809523","0.08321693121693122","1.3","female","Let's find this type."
"1921","01:48:03,200","01:48:04,200","1.0","0.07692307692307693","0.07559788359788361","1.5","female","All together."
"1922","01:48:04,843","01:48:05,843","1.0","0.07142857142857142","0.06755555555555556","1.7","female","A year passes."
"1923","01:48:05,868","01:48:07,256","1.388","0.12618181818181817","0.1131005291005291","1.0","female","Two passes."
"1924","01:48:07,586","01:48:08,586","1.0","0.1","0.09532275132275132","1.2","female","That's it."
"1925","01:48:08,754","01:48:09,754","1.0","0.125","0.1131005291005291","1.0","female","It ends."
"1926","01:48:09,882","01:48:10,882","1.0","0.125","0.1131005291005291","1.0","female","It ends."
"1927","01:48:11,677","01:48:13,070","1.393","0.05572","0.054603174603174605","2.1","female","By the way, I don't know."
"1928","01:48:13,095","01:48:17,044","3.949","0.05983333333333333","0.057227513227513224","2.0","female","I don't have either. I don't have my point of view. I see a lot..."
"1929","01:48:17,069","01:48:19,538","2.469","0.22445454545454543","0.1903915343915344","0.6","female","In general,"
"1930","01:48:19,562","01:48:24,355","4.793","0.05705952380952381","0.054603174603174605","2.1","female","I would say that this Zelensky-Zaluzhny is such, in fact, it is a very simple story."
"1931","01:48:24,380","01:48:31,037","6.657","0.09245833333333334","0.08321693121693122","1.3","female","This is a story about the fact that two people have about 95% in common."
"1932","01:48:32,469","01:48:37,576","5.107","0.056744444444444445","0.054603174603174605","2.1","female","But through our colleagues, through me, through you, through everyone, through many, many,"
"1933","01:48:37,601","01:48:44,392","6.791","0.0808452380952381","0.07559788359788361","1.5","female","and those who write on the Internet, we, these 5%, became so important that they are"
"1934","01:48:44,417","01:48:46,417","2.0","0.08333333333333333","0.08321693121693122","1.3","female","more important than 95%."
"1935","01:48:48,200","01:48:52,988","4.788","0.1368","0.13104761904761905","0.9","female","Imagine that someone wants to lose,"
"1936","01:48:53,012","01:48:57,304","4.292","0.06812698412698412","0.06755555555555556","1.7","female","does not want money from America, someone does not want weapons"
"1937","01:48:57,329","01:49:03,074","5.745","0.11724489795918368","0.1131005291005291","1.0","female","from America, someone does not want Putin to die."
"1938","01:49:04,185","01:49:08,200","4.015","0.05082278481012658","0.049439153439153435","2.3","female","If you take and calculate how much they have in common, then in common they are"
"1939","01:49:08,200","01:49:09,200","1.0","0.1","0.09532275132275132","1.2","female","like this."
"1940","01:49:10,526","01:49:12,901","2.375","0.06597222222222222","0.06425396825396826","1.8","female","And differently, they are like this."
"1941","01:49:13,298","01:49:15,008","1.71","0.07125","0.06755555555555556","1.7","female","And they shout about it."
"1942","01:49:15,436","01:49:18,669","3.233","0.053","0.05147089947089947","2.2","female","And so according to all parameters, you just need to be calm."
"1943","01:49:18,694","01:49:24,722","6.028","0.0793157894736842","0.07559788359788361","1.5","female","Here I am, as it is called, when there are commissariats, now there are some"
"1944","01:49:24,747","01:49:25,747","1.0","0.07142857142857142","0.06755555555555556","1.7","female","three letters."
"1945","01:49:25,978","01:49:26,659","0.681","0.17025","0.16228571428571428","0.7","female","TCK."
"1946","01:49:26,684","01:49:27,684","1.0","0.25","0.23602116402116402","0.5","female","TCK."
"1947","01:49:28,494","01:49:34,494","6.0","0.08823529411764706","0.08321693121693122","1.3","female","I think on purpose, I am so smart that I always dig into everything."
"1948","01:49:35,200","01:49:40,481","5.281","0.14669444444444443","0.1423068783068783","0.8","female","Scandals on the fingers of one hand."
"1949","01:49:41,200","01:49:44,552","3.352","0.07448888888888888","0.07144973544973544","1.6","female","Something in Odesa, something in Zakarpattia."
"1950","01:49:44,577","01:49:45,982","1.405","0.07394736842105264","0.07144973544973544","1.6","female","Well, such a thing."
"1951","01:49:46,007","01:49:47,453","1.446","0.08033333333333333","0.07559788359788361","1.5","female","And how many TCKs?"
"1952","01:49:47,929","01:49:48,929","1.0","0.1111111111111111","0.10302645502645504","1.1","female","Hundreds."
"1953","01:49:49,723","01:49:51,723","2.0","0.07692307692307693","0.07559788359788361","1.5","female","It is less than a percent."
"1954","01:49:52,743","01:49:58,104","5.361","0.0670125","0.06425396825396826","1.8","female","And the scandal is such that it is so impressive that all TCKs are just fighting"
"1955","01:49:58,129","01:50:02,731","4.602","0.06304109589041096","0.060783068783068786","1.9","female","on the heads of poor people on the street and them in this immediate jail"
"1956","01:50:02,756","01:50:04,501","1.745","0.062321428571428576","0.060783068783068786","1.9","female","and after jail on the front."
"1957","01:50:05,779","01:50:10,886","5.107","0.15959375","0.1423068783068783","0.8","female","Then somewhere I read Oh, 20,000"
"1958","01:50:10,911","01:50:13,614","2.703","0.07722857142857142","0.07559788359788361","1.5","female","people were detained on the border."
"1959","01:50:13,820","01:50:15,820","2.0","0.2857142857142857","0.23602116402116402","0.5","female","20,000!"
"1960","01:50:15,844","01:50:17,813","1.969","0.06153125","0.060783068783068786","1.9","female","There is a million in the front."
"1961","01:50:17,837","01:50:21,142","3.305","0.11016666666666668","0.10302645502645504","1.1","female","20,000 is two f**king percent."
"1962","01:50:22,739","01:50:26,731","3.992","0.08493617021276596","0.08321693121693122","1.3","female","That's much less than in any army in the world."
"1963","01:50:27,588","01:50:32,642","5.054","0.08566101694915254","0.08321693121693122","1.3","female","Because those who want to go through the war are much more."
"1964","01:50:34,652","01:50:40,394","5.742","0.087","0.08321693121693122","1.3","female","Someone calculated how many people were going freely to the front."
"1965","01:50:40,925","01:50:42,925","2.0","0.04878048780487805","0.04791534391534392","2.4","female","I talked with people from the front line."
"1966","01:50:43,663","01:50:47,654","3.991","0.07256363636363637","0.07144973544973544","1.6","female","They say we have queues.  But we don`t know about that."
"1967","01:50:47,679","01:50:51,669","3.99","0.048658536585365855","0.04791534391534392","2.4","female","We know that there is Vasya Pupkin who said that he doesn't want to join the army."
